{"schema_version":2,"artifact":"api_inventory","project":"bench_buggy_shop","generated_at":"2026-10-11T12:34:44Z","endpoints":[{"method":"GET","path_template":"/admin","kind":"page","statuses":{"200":1,"303":1,"403":1},"hosts":["127.0.0.1:8765"],"auth":{"authorization_header":false,"cookie":true},"request":{"content_type":null,"fields":[],"query_params":[],"json_schema":null},"response":{"content_type":"text/html","json_schema":null},"triggers":[{"state_id":"S-f7741d2d65","action":"navigate /admin","role":"user"},{"state_id":"S-d77dfb0b01","action":"navigate /admin","role":"admin"},{"state_id":"S-88601138f1","action":"navigate /admin","role":"guest"}],"samples":3,"aborted":0,"roles":["admin","guest","user"]},{"method":"GET","path_template":"/cart","kind":"page","statuses":{"200":6,"303":1},"hosts":["127.0.0.1:8765"],"auth":{"authorization_header":false,"cookie":true},"request":{"content_type":null,"fields":[],"query_params":[],"json_schema":null},"response":{"content_type":"text/html","json_schema":null},"triggers":[{"state_id":"S-fccaef0188","action":"navigate /cart","role":"user"},{"state_id":"S-24598b0bdc","action":"navigate /cart","role":"user"},{"state_id":"S-e6561ac38e","action":"probe F-f9540101fa:empty","role":"user"},{"state_id":"S-8972d128e2","action":"navigate /cart","role":"admin"},{"state_id":"S-88601138f1","action":"navigate /cart","role":"guest"}],"samples":7,"aborted":0,"roles":["admin","guest","user"]},{"method":"GET","path_template":"/checkout","kind":"page","statuses":{"200":2,"303":1},"hosts":["127.0.0.1:8765"],"auth":{"authorization_header":false,"cookie":true},"request":{"content_type":null,"fields":[],"query_params":[],"json_schema":null},"response":{"content_type":"text/html","json_schema":null},"triggers":[{"state_id":"S-9ceaf34e0b","action":"navigate /checkout","role":"user"},{"state_id":"S-c857a395e5","action":"navigate /checkout","role":"admin"},{"state_id":"S-0f09ddcbca","action":"navigate /checkout","role":"guest"}],"samples":3,"aborted":0,"roles":["admin","guest","user"]},{"method":"GET","path_template":"/help","kind":"page","statuses":{"200":3},"hosts":["127.0.0.1:8765"],"auth":{"authorization_header":false,"cookie":true},"request":{"content_type":null,"fields":[],"query_params":[],"json_schema":null},"response":{"content_type":"text/html","json_schema":null},"triggers":[{"state_id":"S-5ef8a38d0f","action":"navigate /help","role":"user"},{"state_id":"S-5fd967feba","action":"navigate /help","role":"admin"},{"state_id":"S-88601138f1","action":"navigate /help","role":"guest"}],"samples":3,"aborted":0,"roles":["admin","guest","user"]},{"method":"GET","path_template":"/login","kind":"page","statuses":{"200":18},"hosts":["127.0.0.1:8765"],"auth":{"authorization_header":false,"cookie":true},"request":{"content_type":null,"fields":[],"query_params":["next"],"json_schema":null},"response":{"content_type":"text/html","json_schema":null},"triggers":[{"state_id":null,"action":"navigate /login","role":"user"},{"state_id":"S-0a3ac39f39","action":"navigate /login","role":"user"},{"state_id":null,"action":"navigate /login","role":"admin"},{"state_id":null,"action":"navigate /login","role":"guest"},{"state_id":"S-0a3ac39f39","action":"navigate /products","role":"guest"},{"state_id":"S-88601138f1","action":"navigate /products/new","role":"guest"},{"state_id":"S-88601138f1","action":"navigate /cart","role":"guest"},{"state_id":"S-88601138f1","action":"navigate /upload","role":"guest"},{"state_id":"S-88601138f1","action":"navigate /admin","role":"guest"},{"state_id":"S-0f09ddcbca","action":"navigate /checkout","role":"guest"}],"samples":18,"aborted":0,"roles":["admin","guest","user"]},{"method":"GET","path_template":"/products","kind":"page","statuses":{"200":4,"303":2},"hosts":["127.0.0.1:8765"],"auth":{"authorization_header":false,"cookie":true},"request":{"content_type":null,"fields":[],"query_params":["page"],"json_schema":null},"response":{"content_type":"text/html","json_schema":null},"triggers":[{"state_id":"S-0a3ac39f39","action":"navigate /products","role":"user"},{"state_id":"S-e6561ac38e","action":"navigate /products","role":"user"},{"state_id":"S-0a3ac39f39","action":"navigate /products","role":"admin"},{"state_id":"S-7e1b62cb9a","action":"navigate /products","role":"admin"},{"state_id":"S-0a3ac39f39","action":"navigate /products","role":"guest"},{"state_id":"S-0f09ddcbca","action":"navigate /products","role":"guest"}],"samples":6,"aborted":0,"roles":["admin","guest","user"]},{"method":"GET","path_template":"/products/new","kind":"page","statuses":{"200":11,"303":1},"hosts":["127.0.0.1:8765"],"auth":{"authorization_header":false,"cookie":true},"request":{"content_type":null,"fields":[],"query_params":[],"json_schema":null},"response":{"content_type":"text/html","json_schema":null},"triggers":[{"state_id":"S-853cc2c96c","action":"navigate /products/new","role":"user"},{"state_id":"S-fccaef0188","action":"navigate /products/new","role":"user"},{"state_id":"S-b2e3218c60","action":"navigate /products/new","role":"admin"},{"state_id":"S-88601138f1","action":"navigate /products/new","role":"guest"}],"samples":12,"aborted":0,"roles":["admin","guest","user"]},{"method":"GET","path_template":"/products/{id}","kind":"page","statuses":{"200":7,"303":1},"hosts":["127.0.0.1:8765"],"auth":{"authorization_header":false,"cookie":true},"request":{"content_type":null,"fields":[],"query_params":[],"json_schema":null},"response":{"content_type":"text/html","json_schema":null},"triggers":[{"state_id":"S-80ede1ae72","action":"navigate /products/1","role":"user"},{"state_id":"S-e6561ac38e","action":"navigate /products/1","role":"user"},{"state_id":"S-4471783184","action":"navigate /products/1","role":"admin"},{"state_id":"S-0f09ddcbca","action":"navigate /products/1","role":"guest"}],"samples":8,"aborted":0,"roles":["admin","guest","user"]},{"method":"GET","path_template":"/products/{id}/edit","kind":"page","statuses":{"200":11,"303":1},"hosts":["127.0.0.1:8765"],"auth":{"authorization_header":false,"cookie":true},"request":{"content_type":null,"fields":[],"query_params":[],"json_schema":null},"response":{"content_type":"text/html","json_schema":null},"triggers":[{"state_id":"S-b56fae9d93","action":"navigate /products/1/edit","role":"user"},{"state_id":"S-d68927eb40","action":"navigate /products/1/edit","role":"user"},{"state_id":"S-a99eea977e","action":"navigate /products/1/edit","role":"admin"},{"state_id":"S-0f09ddcbca","action":"navigate /products/1/edit","role":"guest"}],"samples":12,"aborted":0,"roles":["admin","guest","user"]},{"method":"GET","path_template":"/upload","kind":"page","statuses":{"200":5,"303":1},"hosts":["127.0.0.1:8765"],"auth":{"authorization_header":false,"cookie":true},"request":{"content_type":null,"fields":[],"query_params":[],"json_schema":null},"response":{"content_type":"text/html","json_schema":null},"triggers":[{"state_id":"S-24598b0bdc","action":"navigate /upload","role":"user"},{"state_id":"S-f7741d2d65","action":"navigate /upload","role":"user"},{"state_id":"S-708b57979b","action":"navigate /upload","role":"admin"},{"state_id":"S-88601138f1","action":"navigate /upload","role":"guest"}],"samples":6,"aborted":0,"roles":["admin","guest","user"]},{"method":"POST","path_template":"/cart/add","kind":"form_submit","statuses":{"303":1,"400":3},"hosts":["127.0.0.1:8765"],"auth":{"authorization_header":false,"cookie":true},"request":{"content_type":"application/x-www-form-urlencoded","fields":["product_id","quantity"],"query_params":[],"json_schema":null},"response":{"content_type":"text/html","json_schema":null},"triggers":[{"state_id":"S-e6561ac38e","action":"probe F-f9540101fa:empty","role":"user"},{"state_id":"S-e6561ac38e","action":"probe F-f9540101fa:below_min:quantity","role":"user"},{"state_id":"S-e6561ac38e","action":"probe F-f9540101fa:above_max:quantity","role":"user"},{"state_id":"S-e6561ac38e","action":"probe F-f9540101fa:non_integer:quantity","role":"user"}],"samples":4,"aborted":0,"roles":["user"]},{"method":"POST","path_template":"/cart/discount","kind":"form_submit","statuses":{"400":2},"hosts":["127.0.0.1:8765"],"auth":{"authorization_header":false,"cookie":true},"request":{"content_type":"application/x-www-form-urlencoded","fields":["code"],"query_params":[],"json_schema":null},"response":{"content_type":"text/html","json_schema":null},"triggers":[{"state_id":"S-24598b0bdc","action":"probe F-4c155852d5:empty","role":"user"},{"state_id":"S-24598b0bdc","action":"probe F-4c155852d5:too_long:code","role":"user"}],"samples":2,"aborted":0,"roles":["user"]},{"method":"POST","path_template":"/login","kind":"form_submit","statuses":{"401":2},"hosts":["127.0.0.1:8765"],"auth":{"authorization_header":false,"cookie":true},"request":{"content_type":"application/x-www-form-urlencoded","fields":["next","password","username"],"query_params":[],"json_schema":null},"response":{"content_type":"text/html","json_schema":null},"triggers":[{"state_id":"S-0a3ac39f39","action":"probe F-31696bd201:too_long:username","role":"user"},{"state_id":"S-0a3ac39f39","action":"probe F-31696bd201:too_long:password","role":"user"}],"samples":2,"aborted":0,"roles":["user"]},{"method":"POST","path_template":"/upload","kind":"form_submit","statuses":{"400":2},"hosts":["127.0.0.1:8765"],"auth":{"authorization_header":false,"cookie":true},"request":{"content_type":"multipart/form-data","fields":["file"],"query_params":[],"json_schema":null},"response":{"content_type":"text/html","json_schema":null},"triggers":[{"state_id":"S-f7741d2d65","action":"probe F-cfd30d2f5e:empty","role":"user"},{"state_id":"S-f7741d2d65","action":"probe F-cfd30d2f5e:wrong_accept:file","role":"user"}],"samples":2,"aborted":0,"roles":["user"]}]}